{
  "schemaVersion": "edition-rubric-receipt/1",
  "date": "2026-09-09",
  "rubric": {
    "version": "edition-rubric/1",
    "revision": 1
  },
  "runs": [
    {
      "runId": "660092bf-4948-4fb6-aa5e-c31ccfb13727",
      "reportRef": "edition/runs/2026-09-09-2734368fcdaa38cd3b93ec236a886e5327de906313237597ecdc299622d9931c.json",
      "status": "no_edition",
      "grade": null,
      "ungraded": "This run ended before the quality gate was reached, so it recorded no metrics to grade."
    },
    {
      "runId": "52d694c2-6ad4-4b21-96d8-4de1ce9ad481",
      "reportRef": "edition/runs/2026-09-09-8cf065aa82bebfb1e8350b7e19f506d1b573bfa67e5b9649e5f45899a9b49ea9.json",
      "status": "edition",
      "grade": {
        "criteria": [
          {
            "code": "minimum_successful_sources",
            "category": "evidence",
            "outcome": "met"
          },
          {
            "code": "minimum_candidate_items",
            "category": "evidence",
            "outcome": "met"
          },
          {
            "code": "minimum_cited_sources",
            "category": "evidence",
            "outcome": "met"
          },
          {
            "code": "minimum_signal_strength",
            "category": "evidence",
            "outcome": "met"
          },
          {
            "code": "maximum_single_source_share",
            "category": "independence",
            "outcome": "met"
          },
          {
            "code": "minimum_source_diversity",
            "category": "independence",
            "outcome": "met"
          },
          {
            "code": "maximum_duplicate_story_similarity",
            "category": "originality",
            "outcome": "met"
          },
          {
            "code": "maximum_repeated_topic_frequency",
            "category": "originality",
            "outcome": "met"
          },
          {
            "code": "primary_source_required",
            "category": "evidence",
            "outcome": "met"
          },
          {
            "code": "maximum_unsupported_watchlist_items",
            "category": "evidence",
            "outcome": "met"
          },
          {
            "code": "hard_cost_unavailable",
            "category": "cost",
            "outcome": "met"
          },
          {
            "code": "edition_production_budget",
            "category": "cost",
            "outcome": "met"
          },
          {
            "code": "warning_cost_per_run",
            "category": "cost",
            "outcome": "met"
          },
          {
            "code": "hard_cost_per_run",
            "category": "cost",
            "outcome": "met"
          }
        ],
        "recorded": [],
        "regraded": [],
        "divergence": []
      },
      "ungraded": null
    }
  ],
  "summary": {
    "runs": 2,
    "graded": 1,
    "ungraded": 1,
    "passed": 1,
    "failed": 0,
    "diverged": 0
  }
}
